{
  "protocol_version": "0.6.0",
  "run_id": "run_multi-harness-partial",
  "phase": "achieved",
  "records": [
    {"channel": "agent_identity", "scope": "run", "status": "complete", "capture_sources": ["harness"], "harness_id": "codex", "harness_version": "1.2.3", "adapter_version": "0.1.0", "warnings": []},
    {"channel": "agent_parentage", "scope": "run", "status": "complete", "capture_sources": ["harness"], "harness_id": "codex", "harness_version": "1.2.3", "adapter_version": "0.1.0", "warnings": []},
    {"channel": "agent_lifecycle", "scope": "run", "status": "complete", "capture_sources": ["harness"], "harness_id": "codex", "harness_version": "1.2.3", "adapter_version": "0.1.0", "warnings": []},
    {"channel": "workspace_identity", "scope": "run", "status": "complete", "capture_sources": ["harness", "runner"], "harness_id": "codex", "harness_version": "1.2.3", "adapter_version": "0.1.0", "warnings": []},
    {"channel": "conversation", "scope": "run", "status": "complete", "capture_sources": ["harness"], "harness_id": "codex", "harness_version": "1.2.3", "adapter_version": "0.1.0", "warnings": []},
    {"channel": "returned_reasoning", "scope": "run", "status": "complete", "capture_sources": ["harness"], "harness_id": "codex", "harness_version": "1.2.3", "adapter_version": "0.1.0", "warnings": []},
    {"channel": "model_transport", "scope": "run", "status": "complete", "capture_sources": ["gateway"], "harness_id": "codex", "harness_version": "1.2.3", "adapter_version": "0.1.0", "warnings": []},
    {"channel": "response_stream", "scope": "run", "status": "complete", "capture_sources": ["gateway"], "harness_id": "codex", "harness_version": "1.2.3", "adapter_version": "0.1.0", "warnings": []},
    {"channel": "model_agent_attribution", "scope": "run", "status": "partial", "reason_code": "harness_surface_partial", "capture_sources": ["gateway", "harness"], "harness_id": "codex", "harness_version": "1.2.3", "adapter_version": "0.1.0", "warnings": ["One gateway request lacked a shared native request ID."]},
    {"channel": "tool_calls", "scope": "run", "status": "complete", "capture_sources": ["harness"], "harness_id": "codex", "harness_version": "1.2.3", "adapter_version": "0.1.0", "warnings": []},
    {"channel": "tool_results", "scope": "run", "status": "complete", "capture_sources": ["harness"], "harness_id": "codex", "harness_version": "1.2.3", "adapter_version": "0.1.0", "warnings": []},
    {"channel": "tool_agent_attribution", "scope": "run", "status": "complete", "capture_sources": ["harness"], "harness_id": "codex", "harness_version": "1.2.3", "adapter_version": "0.1.0", "warnings": []},
    {"channel": "terminal", "scope": "run", "status": "complete", "capture_sources": ["harness"], "harness_id": "codex", "harness_version": "1.2.3", "adapter_version": "0.1.0", "warnings": []},
    {"channel": "filesystem_final_state", "scope": "run", "status": "complete", "capture_sources": ["runner"], "harness_id": "codex", "harness_version": "1.2.3", "adapter_version": "0.1.0", "warnings": []},
    {"channel": "filesystem_history", "scope": "run", "status": "partial", "reason_code": "harness_surface_partial", "capture_sources": ["harness", "runner"], "harness_id": "codex", "harness_version": "1.2.3", "adapter_version": "0.1.0", "warnings": ["File changes were exposed atomically."]},
    {"channel": "filesystem_history", "scope": "workspace", "scope_id": "workspace_child", "status": "partial", "reason_code": "native_timestamp_missing", "capture_sources": ["harness", "runner"], "harness_id": "codex", "harness_version": "1.2.3", "adapter_version": "0.1.0", "warnings": ["One child-workspace change lacked a native timestamp."]}
  ]
}
